{"apiVersion":"guard.partme.ai/v1alpha1","kind":"GuardReport","evaluationId":"sha256:88d5b8c5f962550882decface31eea9e3ea8d99bf7abadb081aeea94b2cbdc83","engineVersion":"0.1.0","contractId":"testguard.engine-map/v1","contractRevision":"cccccccccccccccccccccccccccccccccccccccccccccccccccccccccccccccc","contractDigest":"sha256:e894ac59f516f3d2a83875fd6dad0a0256bf8c1acf0b4c9614aedb822025a634","factsDigest":"sha256:3d46fc545c0833d6c8f1ffe799952dcf9c2826eaf817f0ecb22c5d9c7861e768","analyzer":{"id":"testguard-local-evidence","version":"testguard.engine-map/v1"},"subject":{"id":"fixture:repo","snapshotDigest":"sha256:bbbbbbbbbbbbbbbbbbbbbbbbbbbbbbbbbbbbbbbbbbbbbbbbbbbbbbbbbbbbbbbb"},"evaluations":[{"ruleId":"mandatory","status":"PASS","enforcement":"enforce","matchedFacts":[],"detail":"no forbidden relation found"},{"ruleId":"weakening","status":"PASS","enforcement":"review","matchedFacts":[],"detail":"no forbidden relation found"},{"ruleId":"advisory","status":"PASS","enforcement":"advise","matchedFacts":[],"detail":"no forbidden relation found"}],"decision":"ALLOW","signed":false}