{"apiVersion":"guard.partme.ai/v1alpha1","kind":"GuardReport","evaluationId":"sha256:4b4b18272cb9944f891599b367febf68895995a10f246a527b7ccf0a886c62e5","engineVersion":"0.1.0","contractId":"ruff-f401","contractRevision":"1","contractDigest":"sha256:724a415b4e23c1a64821836b4a26f1a198750057e6328f69ae854675bb04ebb0","factsDigest":"sha256:178c977d4106bdb8869f3dfb6d9fdf762e5ca70d57b02fb35f255374467ca44b","analyzer":{"id":"codeguard.native-projection","version":"0.1.0"},"subject":{"id":"repo","snapshotDigest":"sha256:3727adff524e0616022eadd8f4af21a0778b29fc4c77bdfefd1afce2cbf5e4b7"},"evaluations":[{"ruleId":"f401","status":"INDETERMINATE","enforcement":"review","matchedFacts":[{"subject":"python","predicate":"has","object":"unused-import","source":"scope:ruff_f401_scope_incomplete"}],"detail":"analyzer did not provide a complete fact set: Ruff tool version unavailable; frozen configuration mismatch; frozen source mismatch; frozen tool mismatch; native file incomplete; native file not complete; native scan incomplete; rule settings unavailable; suppression audit unavailable"}],"decision":"BLOCK","signed":false}