{"apiVersion":"guard.partme.ai/v1alpha1","kind":"GuardReport","evaluationId":"sha256:bfe5dc7787bc53340d91a173e30ccd1fadfa3cc9bb25e99d25968a58fa09da22","engineVersion":"0.1.0","contractId":"ruff-f401","contractRevision":"1","contractDigest":"sha256:724a415b4e23c1a64821836b4a26f1a198750057e6328f69ae854675bb04ebb0","factsDigest":"sha256:22814c4b642549b006781c40f8a914ae89598f569b6f4cfd5bc0cf293ab01f9f","analyzer":{"id":"codeguard.native-projection","version":"0.1.0"},"subject":{"id":"repo","snapshotDigest":"sha256:f188129314b856b4c77f46eba1c4fe622e01cf5f96958f5a0f69a7bf4cbbc5cc"},"evaluations":[{"ruleId":"f401","status":"PASS","enforcement":"review","matchedFacts":[],"detail":"no forbidden relation found"}],"decision":"ALLOW","signed":false}