{"apiVersion":"guard.partme.ai/v1alpha1","kind":"GuardReport","evaluationId":"sha256:2afdd46d3ca891d19763f26aeaf317f21730856bf6b7ffbddba8dde81cf0fb57","engineVersion":"0.1.0","contractId":"testguard.engine-map/v1","contractRevision":"cccccccccccccccccccccccccccccccccccccccccccccccccccccccccccccccc","contractDigest":"sha256:e894ac59f516f3d2a83875fd6dad0a0256bf8c1acf0b4c9614aedb822025a634","factsDigest":"sha256:77e2f29ca6ae1ed12e5179a6822f8558e36a3cd4f918e1ea43d0bd93f1a772b3","analyzer":{"id":"testguard-local-evidence","version":"testguard.engine-map/v1"},"subject":{"id":"fixture:repo","snapshotDigest":"sha256:bbbbbbbbbbbbbbbbbbbbbbbbbbbbbbbbbbbbbbbbbbbbbbbbbbbbbbbbbbbbbbbb"},"evaluations":[{"ruleId":"mandatory","status":"INDETERMINATE","enforcement":"enforce","matchedFacts":[{"subject":"testguard:assessment","predicate":"has","object":"unsatisfied","source":"{\"obligation_id\":\"O3\",\"test_id\":\"case3\",\"environment\":\"windows\"}"}],"detail":"analyzer did not provide a complete fact set: 1 required test/environment scopes lack a finished execution"},{"ruleId":"weakening","status":"INDETERMINATE","enforcement":"review","matchedFacts":[],"detail":"analyzer did not provide a complete fact set: 1 required test/environment scopes lack a finished execution"},{"ruleId":"advisory","status":"INDETERMINATE","enforcement":"advise","matchedFacts":[],"detail":"analyzer did not provide a complete fact set: 1 required test/environment scopes lack a finished execution"}],"decision":"BLOCK","signed":false}