{"apiVersion":"guard.partme.ai/v1alpha1","kind":"GuardReport","evaluationId":"sha256:df3cb2bc6b61b40f69af5e5302a8f7812c3cad37ee00e305026774ac68314717","engineVersion":"0.1.0","contractId":"ruff-f401","contractRevision":"1","contractDigest":"sha256:e81dcbd8d3d6e36e6147419019212a19f636a48777f1cad6d51967d457c81f3e","factsDigest":"sha256:62a7d7b8d2127c7626fb451b7c3a6d322849416bdd5cd0fb09f8990b24de047e","analyzer":{"id":"codeguard.native-projection","version":"0.1.0"},"subject":{"id":"repo","snapshotDigest":"sha256:3727adff524e0616022eadd8f4af21a0778b29fc4c77bdfefd1afce2cbf5e4b7"},"evaluations":[{"ruleId":"f401","status":"INDETERMINATE","enforcement":"enforce","matchedFacts":[{"subject":"python","predicate":"has","object":"unused-import","source":"scope:ruff_f401_scope_incomplete"}],"detail":"analyzer did not provide a complete fact set: frozen configuration mismatch; required F401 disabled"}],"decision":"BLOCK","signed":false}