{"apiVersion":"guard.partme.ai/v1alpha1","kind":"GuardReport","evaluationId":"sha256:923080a5f601b286752db05099f6fd515b64e382176ba312cffddbe23cb1932e","engineVersion":"0.1.0","contractId":"testguard.engine-map/v1","contractRevision":"cccccccccccccccccccccccccccccccccccccccccccccccccccccccccccccccc","contractDigest":"sha256:e894ac59f516f3d2a83875fd6dad0a0256bf8c1acf0b4c9614aedb822025a634","factsDigest":"sha256:3c38356df1aa81d52e3b901be495520f4c4e8d6a94a20c3584a5681f59615c0d","analyzer":{"id":"testguard-local-evidence","version":"testguard.engine-map/v1"},"subject":{"id":"fixture:repo","snapshotDigest":"sha256:bbbbbbbbbbbbbbbbbbbbbbbbbbbbbbbbbbbbbbbbbbbbbbbbbbbbbbbbbbbbbbbb"},"evaluations":[{"ruleId":"mandatory","status":"PASS","enforcement":"enforce","matchedFacts":[],"detail":"no forbidden relation found"},{"ruleId":"weakening","status":"REVIEW_REQUIRED","enforcement":"review","matchedFacts":[{"subject":"testguard:assessment","predicate":"has","object":"review","source":"AssertionRemoved"}],"detail":"1 relation(s) need approval"},{"ruleId":"advisory","status":"PASS","enforcement":"advise","matchedFacts":[],"detail":"no forbidden relation found"}],"decision":"REQUIRE_APPROVAL","signed":false}