{
  "apiVersion": "guard.partme.ai/v1alpha1",
  "kind": "GuardReport",
  "evaluationId": "sha256:097bf1f5b37a8404b41c0b07d9c7240274e37dda185f4e5285bb5dcb08c866fe",
  "engineVersion": "0.1.0",
  "contractId": "agent-job-boundary",
  "contractRevision": "1",
  "contractDigest": "sha256:6a1b79c82db12ace62bc33ed445df445bd532ebf0a4959fc7178a87a5c68cb2b",
  "factsDigest": "sha256:44af8ffbeaaac5fed75c731222fe29e4a7fb412665de21e38624fc08dbed8a11",
  "analyzer": {
    "id": "archguard.cargo.workspace",
    "version": "0.1.0"
  },
  "subject": {
    "id": "/workspace/guard-implementation-ledger/ge-archguard-matrix/archguard/fixtures/allowed",
    "snapshotDigest": "sha256:3e2be9ddf0b5165a3be9ce258c3d8ca4b1d65a7a456394108c7369c410417187"
  },
  "evaluations": [
    {
      "ruleId": "AGJ-ARCH-001",
      "status": "PASS",
      "enforcement": "enforce",
      "matchedFacts": [],
      "detail": "no forbidden relation found"
    }
  ],
  "decision": "ALLOW",
  "signed": false
}
