{"apiVersion":"guard.partme.ai/v1alpha1","kind":"GuardReport","evaluationId":"sha256:6d6bac7bf0f71ecc5d4b9b183f4ec0dc986e22d20ce4eea236113b561a7b24c6","engineVersion":"0.1.0","contractId":"ruff-f401","contractRevision":"1","contractDigest":"sha256:724a415b4e23c1a64821836b4a26f1a198750057e6328f69ae854675bb04ebb0","factsDigest":"sha256:e7c6ea647421f8ccc790da0e0f48649c0d1ba95dc21d08dcf2cde1b04797139a","analyzer":{"id":"codeguard.native-projection","version":"0.1.0"},"subject":{"id":"repo","snapshotDigest":"sha256:3727adff524e0616022eadd8f4af21a0778b29fc4c77bdfefd1afce2cbf5e4b7"},"evaluations":[{"ruleId":"f401","status":"INDETERMINATE","enforcement":"review","matchedFacts":[{"subject":"python","predicate":"has","object":"unused-import","source":"scope:ruff_f401_scope_incomplete"}],"detail":"analyzer did not provide a complete fact set: frozen configuration mismatch; per-file ignores unsupported"}],"decision":"BLOCK","signed":false}