{"apiVersion":"guard.partme.ai/v1alpha1","kind":"GuardReport","evaluationId":"sha256:f992234e9d6e5c931ac30ec31bf69a00d8d5cc20aa632a20f39e3f182e919dd6","engineVersion":"0.1.0","contractId":"ruff-f401","contractRevision":"1","contractDigest":"sha256:e81dcbd8d3d6e36e6147419019212a19f636a48777f1cad6d51967d457c81f3e","factsDigest":"sha256:e7c6ea647421f8ccc790da0e0f48649c0d1ba95dc21d08dcf2cde1b04797139a","analyzer":{"id":"codeguard.native-projection","version":"0.1.0"},"subject":{"id":"repo","snapshotDigest":"sha256:3727adff524e0616022eadd8f4af21a0778b29fc4c77bdfefd1afce2cbf5e4b7"},"evaluations":[{"ruleId":"f401","status":"INDETERMINATE","enforcement":"enforce","matchedFacts":[{"subject":"python","predicate":"has","object":"unused-import","source":"scope:ruff_f401_scope_incomplete"}],"detail":"analyzer did not provide a complete fact set: frozen configuration mismatch; per-file ignores unsupported"}],"decision":"BLOCK","signed":false}