{"apiVersion":"guard.partme.ai/v1alpha1","kind":"GuardReport","evaluationId":"sha256:40c335ee3d0260df8f51f2fa6558a5ec09385a2f0ad92ddf6741be69cabcc350","engineVersion":"0.1.0","contractId":"ruff-f401","contractRevision":"1","contractDigest":"sha256:724a415b4e23c1a64821836b4a26f1a198750057e6328f69ae854675bb04ebb0","factsDigest":"sha256:62a7d7b8d2127c7626fb451b7c3a6d322849416bdd5cd0fb09f8990b24de047e","analyzer":{"id":"codeguard.native-projection","version":"0.1.0"},"subject":{"id":"repo","snapshotDigest":"sha256:3727adff524e0616022eadd8f4af21a0778b29fc4c77bdfefd1afce2cbf5e4b7"},"evaluations":[{"ruleId":"f401","status":"INDETERMINATE","enforcement":"review","matchedFacts":[{"subject":"python","predicate":"has","object":"unused-import","source":"scope:ruff_f401_scope_incomplete"}],"detail":"analyzer did not provide a complete fact set: frozen configuration mismatch; required F401 disabled"}],"decision":"BLOCK","signed":false}