{"apiVersion":"guard.partme.ai/v1alpha1","kind":"GuardReport","evaluationId":"sha256:79f20ac97cc4d14818a379d46e8203970df0a83d71c7f27e85b939516fcda485","engineVersion":"0.1.0","contractId":"ruff-f401","contractRevision":"1","contractDigest":"sha256:724a415b4e23c1a64821836b4a26f1a198750057e6328f69ae854675bb04ebb0","factsDigest":"sha256:123d984814ada7b4db3cb6d046b7d5cad00d0ea61989767802daad228814abbd","analyzer":{"id":"codeguard.native-projection","version":"0.1.0"},"subject":{"id":"repo","snapshotDigest":"sha256:b15b6f75e5ec44aa81abd72063b2a533ec112e54c88857f6c521318eb9fd44f5"},"evaluations":[{"ruleId":"f401","status":"INDETERMINATE","enforcement":"review","matchedFacts":[{"subject":"python","predicate":"has","object":"unused-import","source":"scope:ruff_f401_scope_incomplete"}],"detail":"analyzer did not provide a complete fact set: native file not complete; source suppression unsupported"}],"decision":"BLOCK","signed":false}