{"apiVersion":"guard.partme.ai/v1alpha1","kind":"GuardReport","evaluationId":"sha256:25d644635f04aceee6cac50a384d1cd9e7fabe1f254af6ab957d3352e1e724ef","engineVersion":"0.1.0","contractId":"ruff-f401","contractRevision":"1","contractDigest":"sha256:724a415b4e23c1a64821836b4a26f1a198750057e6328f69ae854675bb04ebb0","factsDigest":"sha256:d8eed1c8171662eb2bdc30f6ab92dfc72f12480c9ac373a398080779d57c5a15","analyzer":{"id":"codeguard.native-projection","version":"0.1.0"},"subject":{"id":"repo","snapshotDigest":"sha256:8ade5dc0b99fd2af8b246472c8ed410337fc4a214aa5792b979b49f9dc83ecdf"},"evaluations":[{"ruleId":"f401","status":"PASS","enforcement":"review","matchedFacts":[],"detail":"no forbidden relation found"}],"decision":"ALLOW","signed":false}