{"apiVersion":"guard.partme.ai/v1alpha1","kind":"GuardReport","evaluationId":"sha256:ac256164a54fa750d4965280506dd0fa00ce89e6c3d7fa97d5c893d9edf8af64","engineVersion":"0.1.0","contractId":"ruff-f401","contractRevision":"1","contractDigest":"sha256:e81dcbd8d3d6e36e6147419019212a19f636a48777f1cad6d51967d457c81f3e","factsDigest":"sha256:d8eed1c8171662eb2bdc30f6ab92dfc72f12480c9ac373a398080779d57c5a15","analyzer":{"id":"codeguard.native-projection","version":"0.1.0"},"subject":{"id":"repo","snapshotDigest":"sha256:8ade5dc0b99fd2af8b246472c8ed410337fc4a214aa5792b979b49f9dc83ecdf"},"evaluations":[{"ruleId":"f401","status":"PASS","enforcement":"enforce","matchedFacts":[],"detail":"no forbidden relation found"}],"decision":"ALLOW","signed":false}