{"apiVersion":"guard.partme.ai/v1alpha1","kind":"GuardReport","evaluationId":"sha256:5f8415c6e3da126d51c6bc598b37e2055cac6eaaf5a1e5573cce35b7151f03d5","engineVersion":"0.1.0","contractId":"ruff-f401","contractRevision":"1","contractDigest":"sha256:e81dcbd8d3d6e36e6147419019212a19f636a48777f1cad6d51967d457c81f3e","factsDigest":"sha256:123d984814ada7b4db3cb6d046b7d5cad00d0ea61989767802daad228814abbd","analyzer":{"id":"codeguard.native-projection","version":"0.1.0"},"subject":{"id":"repo","snapshotDigest":"sha256:b15b6f75e5ec44aa81abd72063b2a533ec112e54c88857f6c521318eb9fd44f5"},"evaluations":[{"ruleId":"f401","status":"INDETERMINATE","enforcement":"enforce","matchedFacts":[{"subject":"python","predicate":"has","object":"unused-import","source":"scope:ruff_f401_scope_incomplete"}],"detail":"analyzer did not provide a complete fact set: native file not complete; source suppression unsupported"}],"decision":"BLOCK","signed":false}