{"apiVersion":"guard.partme.ai/v1alpha1","kind":"GuardReport","evaluationId":"sha256:2d75cacb744f0c711d965001e8b733720e604fce7a24e2920014e91c1e400b5a","engineVersion":"0.1.0","contractId":"ruff-f401","contractRevision":"1","contractDigest":"sha256:e81dcbd8d3d6e36e6147419019212a19f636a48777f1cad6d51967d457c81f3e","factsDigest":"sha256:59c61d036fd79da76cdaaac180ea95b06789a114be6d3f231c1aa8f6d1bfaef5","analyzer":{"id":"codeguard.native-projection","version":"0.1.0"},"subject":{"id":"repo","snapshotDigest":"sha256:3727adff524e0616022eadd8f4af21a0778b29fc4c77bdfefd1afce2cbf5e4b7"},"evaluations":[{"ruleId":"f401","status":"INDETERMINATE","enforcement":"enforce","matchedFacts":[{"subject":"python","predicate":"has","object":"unused-import","source":"scope:ruff_f401_scope_incomplete"}],"detail":"analyzer did not provide a complete fact set: frozen source mismatch"}],"decision":"BLOCK","signed":false}