{"analyzer":{"id":"archguard.cargo.declarations","version":"0.1.0"},"apiVersion":"guard.partme.ai/v1alpha1","contractDigest":"sha256:6a1b79c82db12ace62bc33ed445df445bd532ebf0a4959fc7178a87a5c68cb2b","contractId":"agent-job-boundary","contractRevision":"1","decision":"BLOCK","engineVersion":"0.1.0","evaluationId":"sha256:3e1913c187b5be21607e627e2ea0b8d02306b3257a91975728da15bfc6354a69","evaluations":[{"detail":"found 1 forbidden relation(s)","enforcement":"enforce","matchedFacts":[{"object":"agent-saas","predicate":"depends_on","source":"agent-job/Cargo.toml","subject":"agent-job"}],"ruleId":"AGJ-ARCH-001","status":"FAIL"}],"factsDigest":"sha256:99d2b166f41c37df37d95a3270353bc076c86087e04d4d2f5acde75d1c647422","kind":"GuardReport","signed":false,"subject":{"id":"cargo:sha256:28f0e746174acaad8499488dc5810022a0494c644e639a1ed0886c42d5d19b01","snapshotDigest":"sha256:22231782ae08badb7aa64e1e6283fe36bdd0eadda76c852ae4fa7f3a41cf590f"}}