{"apiVersion":"guard.partme.ai/v1alpha1","kind":"GuardReport","evaluationId":"sha256:3560cfd84fad553b096803f96cf8f64ef9ee948753e976f29928eea614278164","engineVersion":"0.1.0","contractId":"fixture-policy","contractRevision":"1","contractDigest":"sha256:693948231e9c4a15a58bf089d0151db7d6373c1e386fe82c505e52437136518c","factsDigest":"sha256:d6f688c0270184d8515ae7b006c2f3f65b1b5920d3f386e6f34e6dd7b0176bca","analyzer":{"id":"codeguard.native-projection","version":"0.1.0"},"subject":{"id":"repo","snapshotDigest":"sha256:aaaaaaaaaaaaaaaaaaaaaaaaaaaaaaaaaaaaaaaaaaaaaaaaaaaaaaaaaaaaaaaa"},"evaluations":[{"ruleId":"r","status":"INDETERMINATE","enforcement":"advise","matchedFacts":[{"subject":"code","predicate":"has","object":"gap","source":"native:f-1"},{"subject":"code","predicate":"has","object":"gap","source":"scope:native profile unqualified"}],"detail":"analyzer did not provide a complete fact set: native profile unqualified"}],"decision":"BLOCK","signed":false}