{"apiVersion":"guard.partme.ai/v1alpha1","kind":"GuardReport","evaluationId":"sha256:58ac6fcf3d835cf8e09de1e8366ca16527d71f282b0284b932581d2b2374fec2","engineVersion":"0.1.0","contractId":"ruff-f401","contractRevision":"1","contractDigest":"sha256:e81dcbd8d3d6e36e6147419019212a19f636a48777f1cad6d51967d457c81f3e","factsDigest":"sha256:22814c4b642549b006781c40f8a914ae89598f569b6f4cfd5bc0cf293ab01f9f","analyzer":{"id":"codeguard.native-projection","version":"0.1.0"},"subject":{"id":"repo","snapshotDigest":"sha256:f188129314b856b4c77f46eba1c4fe622e01cf5f96958f5a0f69a7bf4cbbc5cc"},"evaluations":[{"ruleId":"f401","status":"PASS","enforcement":"enforce","matchedFacts":[],"detail":"no forbidden relation found"}],"decision":"ALLOW","signed":false}