{"analyzer":{"id":"gitguard.git-scope","version":"1"},"apiVersion":"guard.partme.ai/v1alpha1","contractDigest":"sha256:f7922b9067977c89b6e0da60b463a64073e7b91aadadd718615f2dc3b768db23","contractId":"gitguard.scope","contractRevision":"1","decision":"ALLOW","engineVersion":"0.1.0","evaluationId":"sha256:e944ff9528b3725a289f3b2b0abf6ba546425ee5923355f08a778c048e9c6947","evaluations":[{"detail":"no forbidden relation found","enforcement":"enforce","matchedFacts":[],"ruleId":"scope.allowed-paths","status":"PASS"}],"factsDigest":"sha256:48f5fd5173c9073cdd00f03b66bc79356c3fe9173a015e8bbaa954fdf4451630","kind":"GuardReport","signed":false,"subject":{"id":"git-scope:097a0ebfec9eb591ca563913365792c741a8e66c498986463fb0f485e944c7e6","snapshotDigest":"sha256:77a9a1f3b587a56264e48dd9e34f5a800471bb9602d01822e94fc66b7efc7452"}}