{
  "apiVersion": "guard.partme.ai/v1alpha1",
  "kind": "GuardReport",
  "evaluationId": "sha256:a03cf5593799b34ba20ad2e3a3b504eec85ad3ea34bed23f89f4fa0ddcead201",
  "engineVersion": "0.1.0",
  "contractId": "agent-job-boundary",
  "contractRevision": "1",
  "contractDigest": "sha256:6a1b79c82db12ace62bc33ed445df445bd532ebf0a4959fc7178a87a5c68cb2b",
  "factsDigest": "sha256:76e68490ad85b2d566fead9e60eb01fa639c22bc10d220a00a6f907b4b58adff",
  "analyzer": {
    "id": "archguard.cargo.workspace",
    "version": "0.1.0"
  },
  "subject": {
    "id": "/workspace/guard-implementation-ledger/ge-archguard-matrix/archguard/fixtures/forbidden",
    "snapshotDigest": "sha256:ddc445c0daf16eb2f8f224acbebfd325e6fa963bb00a848449824c20bba89b1f"
  },
  "evaluations": [
    {
      "ruleId": "AGJ-ARCH-001",
      "status": "FAIL",
      "enforcement": "enforce",
      "matchedFacts": [
        {
          "subject": "agent-job",
          "predicate": "depends_on",
          "object": "agent-saas",
          "source": "agent-job/Cargo.toml"
        }
      ],
      "detail": "found 1 forbidden relation(s)"
    }
  ],
  "decision": "BLOCK",
  "signed": false
}
